ID,Title,ID,Abstract
1,A Translational Science Model for HCI,1,"Using scientific discoveries to inform design practice is an important, but difficult, objective in HCI. In this paper, we provide an overview of Translational Science in HCI by triangulating literature related to the research-practice gap with interview data from many parties engaged (or not) in translating HCI knowledge. We propose a model for Translational Science in HCI based on the concept of a continuum to describe how knowledge progresses (or stalls) through multiple steps and translations until it can influence design practice. The model offers a conceptual framework that can be used by researchers and practitioners to visualize and describe the progression of HCI knowledge through a sequence of translations. Additionally, the model may facilitate a precise identification of translational barriers, which allows devising more effective strategies to increase the use of scientific findings in design practice."
2,They Don't Leave Us Alone Anywhere We Go: Gender and Digital Abuse in South Asia,2,"South Asia faces one of the largest gender gaps online globally, and online safety is one of the main barriers to gender-equitable Internet access [GSMA, 2015]. To better understand the gendered risks and coping practices online in South Asia, we present a qualitative study of the online abuse experiences and coping practices of 199 people who identified as women and 6 NGO staff from India, Pakistan, and Bangladesh, using a feminist analysis. We found that a majority of our participants regularly contended with online abuse, experiencing three major abuse types: cyberstalking, impersonation, and personal content leakages. Consequences of abuse included emotional harm, reputation damage, and physical and sexual violence. Participants coped through informal channels rather than through technological protections or law enforcement. Altogether, our findings point to opportunities for designs, policies, and algorithms to improve women's safety online in South Asia."
3,Guidelines for Human-AI Interaction,3,"Advances in artificial intelligence (AI) frame opportunities and challenges for user interface design. Principles for human-AI interaction have been discussed in the human-computer interaction community for over two decades, but more study and innovation are needed in light of advances in AI and the growing uses of AI technologies in human-facing applications. We propose 18 generally applicable design guidelines for human-AI interaction. These guidelines are validated through multiple rounds of evaluation including a user study with 49 design practitioners who tested the guidelines against 20 popular AI-infused products. The results verify the relevance of the guidelines over a spectrum of interaction scenarios and reveal gaps in our knowledge, highlighting opportunities for further research. Based on the evaluations, we believe the set of design guidelines can serve as a resource to practitioners working on the design of applications and features that harness AI technologies, and to researchers interested in the further development of human-AI interaction design principles."
4,Human-Centered Tools for Coping with Imperfect Algorithms During Medical Decision-Making,4,"Machine learning (ML) is increasingly being used in image retrieval systems for medical decision making. One application of ML is to retrieve visually similar medical images from past patients (e.g. tissue from biopsies) to reference when making a medical decision with a new patient. However, no algorithm can perfectly capture an expert's ideal notion of similarity for every case: an image that is algorithmically determined to be similar may not be medically relevant to a doctor's specific diagnostic needs. In this paper, we identified the needs of pathologists when searching for similar images retrieved using a deep learning algorithm, and developed tools that empower users to cope with the search algorithm on-the-fly, communicating what types of similarity are most important at different moments in time. In two evaluations with pathologists, we found that these tools increased the diagnostic utility of images found and increased user trust in the algorithm. The tools were preferred over a traditional interface, without a loss in diagnostic accuracy. We also observed that users adopted new strategies when using refinement tools, re-purposing them to test and understand the underlying algorithm and to disambiguate ML errors from their own errors. Taken together, these findings inform future human-ML collaborative systems for expert decision-making."
5,Seeing with New Eyes: Designing for In-the-Wild Museum Gifting,5,"This paper presents the GIFT smartphone app, an artist-led Research through Design project benefitting from a three-day in-the-wild deployment. The app takes as its premise the generative potential of combining the contexts of gifting and museum visits. Visitors explore the museum, searching for objects that would most appeal to the gift-receiver they have in mind, then photographing those objects and adding audio messages for their receivers describing the motivation for their choices. This paper charts the designers' key aim of creating a new frame of mind using voice, and the most striking findings discovered during in-the-wild deployment in a museum -- 'seeing with new eyes' and fostering personal connections. We discuss empathy, motivation, and bottom-up personalisation in the productive space revealed by this combination of contexts. We suggest that this work reveals opportunities for designers of gifting services as well as those working in cultural heritage."
6,Design and Plural Heritages: Composing Critical Futures,6,"We make theoretical and methodological contributions to the CHI community by introducing comparisons between contemporary Critical Heritage research and some forms of experimental design practice. Beginning by identifying three key approaches in contemporary heritage research: Critical Heritage, Plural Heritages and Future Heritage we introduce these in turn, while exploring their significance for thinking about design, knowledge and diversity. We discuss our efforts to apply ideas integrating Critical Heritage and design through the adoption of known Research through Design techniques in a research project in Istanbul, Turkey describing the design of our study and how this was productive of sensory and speculative reflection on the past. Finally, we reflect on the usefulness of such methods in developing new interactive technologies in heritage contexts and go on to propose a series of recommendations for a future Critical Heritage Design practice."
7,Connect-to-Connected Worlds: Piloting a Mobile Data-Driven Reflection Tool for an Open-Ended Simulation at a Museum,7,"Immersive open-ended museum exhibits promote ludic engagement and can be a powerful draw for visitors, but these qualities may also make learning more challenging. We describe our efforts to help visitors engage more deeply with an interactive exhibit's content by giving them access to visualizations of data skimmed from their use of the exhibit. We report on the motivations and challenges in designing this reflective tool, which positions visitors as a ""human in the loop"" to understand and manage their engagement with the exhibit. We used an iterative design process and qualitative methods to explore how and if visitors could (1) access and (2) comprehend the data visualizations, (3) reflect on their prior engagement with the exhibit, (4)plan their future engagement with the exhibit, and (5) act on their plans. We further discuss the essential design challenges and the opportunities made possible for visitors through data-driven reflection tools."
8,Anchored Audio Sampling: A Seamless Method for Exploring Children's Thoughts During Deployment Studies,8,"Many traditional HCI methods, such as surveys and interviews, are of limited value when working with preschoolers. In this paper, we present anchored audio sampling (AAS), a remote data collection technique for extracting qualitative audio samples during field deployments with young children. AAS offers a developmentally sensitive way of understanding how children make sense of technology and situates their use in the larger context of daily life. AAS is defined by an anchor event, around which audio is collected. A sliding window surrounding this anchor captures both antecedent and ensuing recording, providing the researcher insight into the activities that led up to the event of interest as well as those that followed. We present themes from three deployments that leverage this technique. Based on our experiences using AAS, we have also developed a reusable open-source library for embedding AAS into any Android application."
9,To Asymmetry and Beyond!: Improving Social Connectedness by Increasing Designed Interdependence in Cooperative Play,9,"Social play can have numerous health benefits but research has shown that not all multiplayer games are effective at promoting social engagement. Asymmetric cooperative games have shown promise in this regard but the design and dynamics of this unique style of play is not yet well understood. To address this, we present the results of two player experience studies using our custom prototype game Beam Me 'Round, Scotty! 2: the first comparing symmetric cooperative play (e.g., where players have the same interface, goals, mechanics, etc.) to asymmetric cooperative play (e.g., where players have differing roles, abilities, interfaces, etc.) and the second comparing the effect of increasing degrees of interdependence between play partners. Our results not only indicate that asymmetric cooperative games may enhance players' perceptions of connectedness, social engagement, immersion, and comfort with a game's controls, but also demonstrate how to further improve these outcomes via deliberate mechanical design changes, such as changes in cooperative action timing and direction of dependence."
10,DesignABILITY: Framework for the Design of Accessible Interactive Tools to Support Teaching to Children with Disabilities,10,"Developing educational tools aimed at children with disabilities is a challenging process for designers and developers because existing methodologies or frameworks do not provide any pedagogical information and/or do not take into account the particular needs of users with some type of impairment. In this study, we propose a framework for the design of tools to support teaching to children with disabilities. The framework provides the necessary stages for the development of tools (hardware-based or software-based) and must be adapted for a specific disability and educational goal. For this study, the framework was adapted to support literacy teaching and contributes to the design of educational/interactive technology for deaf people while making them part of the design process and taking into account their particular needs. The experts' evaluation of the framework shows that it is well structured and may be adapted for other types of disabilities."
11,Transcalibur: A Weight Shifting Virtual Reality Controller for 2D Shape Rendering based on Computational Perception Model,11,"Humans can estimate the shape of a wielded object through the illusory feeling of the mass properties of the object obtained using their hands. Even though the shape of hand-held objects influences immersion and realism in virtual reality (VR), it is difficult to design VR controllers for rendering desired shapes according to the perceptions derived from the illusory effects of mass properties and shape perception. We propose Transcalibur, which is a hand-held VR controller that can render a 2D shape by changing its mass properties on a 2D planar area. We built a computational perception model using a data-driven approach from the collected data pairs of mass properties and perceived shapes. This enables Transcalibur to easily and effectively provide convincing shape perception based on complex illusory effects. Our user study showed that the system succeeded in providing the perception of various desired shapes in a virtual environment."
12,LightBee: A Self-Levitating Light Field Display for Hologrammatic Telepresence,12,"LightBee is a novel ""hologrammatic"" telepresence system featuring a self-levitating light field display. It consists of a drone that flies a projection of a remote user's head through 3D space. The movements of the drone are controlled by the remote user's head movements, offering unique support for non-verbal cues, especially physical proxemics. The light field display is created by a retro-reflective sheet that is mounted on the cylindrical quadcopter. 45 smart projectors, one per 1.3 degrees, are mounted in a ring, each projecting a video stream rendered from a unique perspective onto the retroreflector. This creates a light field that naturally provides motion parallax and stereoscopy without requiring any headset nor stereo glasses. LightBee allows multiple local users to experience their own unique and correct perspective of the remote user's head. The system is currently one-directional: 2 small cameras mounted on the drone allow the remote user to observe the local scene."
13,TabletInVR: Exploring the Design Space for Using a Multi-Touch Tablet in Virtual Reality,13,"Complex virtual reality (VR) tasks, like 3D solid modelling, are challenging with standard input controllers. We propose exploiting the affordances and input capabilities when using a 3D-tracked multi-touch tablet in an immersive VR environment. Observations gained during semi-structured interviews with general users, and those experienced with 3D software, are used to define a set of design dimensions and guidelines. These are used to develop a vocabulary of interaction techniques to demonstrate how a tablet's precise touch input capability, physical shape, metaphorical associations, and natural compatibility with barehand mid-air input can be used in VR. For example, transforming objects with touch input, ""cutting"" objects by using the tablet as a physical ""knife"", navigating in 3D by using the tablet as a viewport, and triggering commands by interleaving bare-hand input around the tablet. Key aspects of the vocabulary are evaluated with users, with results validating the approach."
14,RotoSwype: Word-Gesture Typing using a Ring,14,"We propose RotoSwype, a technique for word-gesture typing using the orientation of a ring worn on the index finger. RotoSwype enables one-handed text-input without encumbering the hand with a device, a desirable quality in many scenarios, including virtual or augmented reality. The method is evaluated using two arm positions: with the hand raised up with the palm parallel to the ground; and with the hand resting at the side with the palm facing the body. A five-day study finds both hand positions achieved speeds of at least 14 words-per-minute (WPM) with uncorrected error rates near 1%, outperforming previous comparable techniques."
15,BeamBand: Hand Gesture Sensing with Ultrasonic Beamforming,15,"BeamBand is a wrist-worn system that uses ultrasonic beamforming for hand gesture sensing. Using an array of small transducers, arranged on the wrist, we can ensem-ble acoustic wavefronts to project acoustic energy at spec-ified angles and focal lengths. This allows us to interro-gate the surface geometry of the hand with inaudible sound in a raster-scan-like manner, from multiple view-points. We use the resulting, characteristic reflections to recognize hand pose at 8 FPS. In our user study, we found that BeamBand supports a six-class hand gesture set at 94.6% accuracy. Even across sessions, when the sensor is removed and reworn later, accuracy remains high: 89.4%. We describe our software and hardware, and future ave-nues for integration into devices such as smartwatches and VR controllers."
16,Airport Accessibility and Navigation Assistance for People with Visual Impairments,16,"People with visual impairments often have to rely on the assistance of sighted guides in airports, which prevents them from having an independent travel experience. In order to learn about their perspectives on current airport accessibility, we conducted two focus groups that discussed their needs and experiences in-depth, as well as the potential role of assistive technologies. We found that independent navigation is a main challenge and severely impacts their overall experience. As a result, we equipped an airport with a Bluetooth Low Energy (BLE) beacon-based navigation system and performed a real-world study where users navigated routes relevant for their travel experience. We found that despite the challenging environment participants were able to complete their itinerary independently, presenting none to few navigation errors and reasonable timings. This study presents the first systematic evaluation posing BLE technology as a strong approach to increase the independence of visually impaired people in airports."
17,Effects of Moderation and Opinion Heterogeneity on Attitude towards the Online Deliberation Experience,17,"Online deliberation offers a way for citizens to collectively discuss an issue and provide input for policymakers. The overall experience of online deliberation can be affected by multiple factors. We decided to investigate the effects of moderation and opinion heterogeneity on the perceived deliberation experience, by running the first online deliberation experiment in Singapore. Our study took place in three months with three phases. In phase 1, our 2,006 participants answered a survey, that we used to create groups of different opinion heterogeneity. During the second phase, 510 participants discussed about the population issue on the online platform we developed. We gathered data on their online deliberation experience during phase 3. We found out that higher levels of moderation negatively impact the experience of deliberation on perceived procedural fairness, validity claim and policy legitimacy; and that high opinion heterogeneity is important in order to get a fair assessment of the deliberation experience."
18,MilliSonic: Pushing the Limits of Acoustic Motion Tracking,18,"Recent years have seen interest in device tracking and localization using acoustic signals. State-of-the-art acoustic motion tracking systems however do not achieve millimeter accuracy and require large separation between microphones and speakers, and as a result, do not meet the requirements for many VR/AR applications. Further, tracking multiple concurrent acoustic transmissions from VR devices today requires sacrificing accuracy or frame rate. We present MilliSonic, a novel system that pushes the limits of acoustic based motion tracking. Our core contribution is a novel localization algorithm that can provably achieve sub-millimeter 1D tracking accuracy in the presence of multipath, while using only a single beacon with a small 4-microphone array.Further, MilliSonic enables concurrent tracking of up to four smartphones without reducing frame rate or accuracy. Our evaluation shows that MilliSonic achieves 0.7mm median 1D accuracy and a 2.6mm median 3D accuracy for smartphones, which is 5x more accurate than state-of-the-art systems. MilliSonic enables two previously infeasible interaction applications: a) 3D tracking of VR headsets using the smartphone as a beacon and b) fine-grained 3D tracking for the Google Cardboard VR system using a small microphone array."
19,Casual Microtasking: Embedding Microtasks in Facebook,19,"Microtasks enable people with limited time and context to contribute to a larger task. In this paper we explore casual microtasking, where microtasks are embedded into other primary activities so that they are available to be completed when convenient. We present a casual microtasking experience that inserts writing microtasks from an existing microwriting tool into the user's Facebook feed. From a two-week deployment of the system with nine people, we observe that casual microtasking enabled participants to get things done during their breaks, and that they tended to do so only after first engaging with Facebook's social content. Participants were most likely to complete the writing microtasks during periods of the day associated with low focus, and would occasionally use them as a springboard to open the original document in Word. These findings suggest casual microtasking can help people leverage spare micromoments to achieve meaningful micro-goals, and even encourage them to return to work."
20,Making Sense of Art: Access for Gallery Visitors with Vision Impairments,20,"While there is widespread recognition of the need to provide people with vision impairments (PVI) equitable access to cultural institutions such as art galleries, this is not easy. We present the results of a collaboration with a regional art gallery who wished to open their collection to PVIs in the local community. We describe a novel model that provides three different ways of accessing the gallery, depending upon visual acuity and mobility: virtual tours, self-guided tours and guided tours. As far as possible the model supports autonomous exploration by PVIs. It was informed by a value sensitive design exploration of the values and value conflicts of the primary stakeholders."
21,"Co-Design Beyond Words: ""Moments of Interaction"" with Minimally-Verbal Children on the Autism Spectrum",21,"Existing co-design methods support verbal children on the autism spectrum in the design process, while their minimally-verbal peers are overlooked. We describe Co-Design Beyond Words (CDBW), an approach which merges existing co-design methods with practice-based methods from Speech and Language Therapy which are child-led and interests-based. These emphasise the rich detail that can be conveyed in the moment, through recognising occurrences of, for example, Joint Attention, Turn Taking and Imitation. We worked in an autism-specific primary school over 20 weeks with ten children, aged 5 to 8. We co-designed a playful prototype, the TangiBall, using the three iterative phases of CDBW; the Foundation Phase (preparation for interaction), the Interaction Phase (designing-and-reflecting in the moment) and the Reflection Phase (reflection-on-action). We contribute a novel co-design approach and present moments of interaction, the micro instances in design in which minimally-verbal children on the spectrum can convey meaning beyond words, through their actions, interactions, and attentional foci. These moments of interaction provide design insight, shape design direction, and reveal unique strengths, interests, and abilities."
22,Emotional Utility and Recall of the Facebook News Feed,22,"We report a laboratory study (N=53) in which participants browsed their own Facebook news feeds for 10-15 minutes, choosing exactly when to quit, and later rated the overall emotional utility of the episode before attempting to recall threads. Finally, the emotional utility of each encountered thread was rated while looking over a recording of the interaction. We report that Facebook browsing was, overall, an emotionally positive experience; that recall of threads exhibited classic primacy and recency serial order effects; that recalled threads were both more positive and more valenced (less neutral) on average, than forgotten threads; and that overall emotional valence judgments were predicted, statistically, by the peak and end thread judgments. We find no evidence that local quit decisions were driven by the emotional utility of threads. In the light of these findings, we discuss the suggestion that emotional utility might partly explain the attractiveness of reading the news feed, and that an emotional memory bias might further increase the attractiveness of the newsfeed in prospect."
23,The Breaking Hand: Skills Care and Sufferings of the Hands of an Electronic Waste Worker in Bangladesh,23,"While repair work has recently been getting increasing attention in HCI, recycling practices have still remained relatively understudied, especially in the context of the Global South. To this end, building on our eight-month-long ethnography, this paper reports the electronic waste (`e-waste', henceforth) recycling practices among the e-waste recycler (`bhangari') communities in Dhaka, Bangladesh. In doing so, this paper offers the work of the bhangaris through an articulation of their hands and their uses. Drawing from a rich body of scholarly work on social science, we define and contextualize three characteristics of the hand of a bhangari: knowledge, care, and skills and collaboration. Our study also highlights the pains and sufferings involved in this profession. By explaining bhangari work through the hand, we also discuss its implications for design, and its connection to HCI's broader interest in sustainability."
24,EarTouch: Facilitating Smartphone Use for Visually Impaired People in Mobile and Public Scenarios,24,"Interacting with a smartphone using touch input and speech output is challenging for visually impaired people in mobile and public scenarios, where only one hand may be available for input (e.g., while holding a cane) and using the loudspeaker for speech output is constrained by environmental noise, privacy, and social concerns. To address these issues, we propose EarTouch, a one-handed interaction technique that allows the users to interact with a smartphone using the ear to perform gestures on the touchscreen. Users hold the phone to their ears and listen to speech output from the ear speaker privately. We report how the technique was designed, implemented, and evaluated through a series of studies. Results show that EarTouch is easy, efficient, fun and socially acceptable to use."
