ID,Title,ID,Abstract
189,Exploring the Opportunities for Technologies to Enhance Quality of Life with People who have Experienced Vision Loss,189,"Research predicts that 196 million people will be diagnosed with Age-Related Macular Degeneration (AMD) by 2020. People who experience AMD and other vision loss face barriers that affect their Quality of Life (QoL). People experience only modest improvement from technologies (e.g., screen readers, CCTV), tools (e.g., magnifying glasses, tactile buttons), and human help (e.g., friends, blindness organizations). Further, there are issues to accessing these resources based on one's place of residence. To explore these challenges and determine design implications to support people who have experienced vision loss (PVL), we conducted a qualitative semi-structured interview study exploring QoL with 10 PVL. We uncovered themes of supporting creative work, recognizing the impact of one's living in a non-urban setting on QoL, and increasing efficiency at accomplishing tasks. We motivate the inclusion of PVL in the design process because they learned skills while sighted and are now low vision or blind."
190,Ranked-List Visualization: A Graphical Perception Study,190,"Visualization of ranked lists is a common occurrence, but many in-the-wild solutions fly in the face of vision science and visualization wisdom. For example, treemaps and bubble charts are commonly used for this purpose, despite the fact that the data is not hierarchical and that length is easier to perceive than area. Furthermore, several new visual representations have recently been suggested in this area, including wrapped bars, packed bars, piled bars, and Zvinca plots. To quantify the differences and trade-offs for these ranked-list visualizations, we here report on a crowdsourced graphical perception study involving six such visual representations, including the ubiquitous scrolled barchart, in three tasks: ranking (assessing a single item), comparison (two items), and average (assessing global distribution). Results show that wrapped bars may be the best choice for visualizing ranked lists, and that treemaps are surprisingly accurate despite the use of area rather than length to represent value."
191,A Lie Reveals the Truth: Quasimodes for Task-Aligned Data Presentation,191,"Designers are often discouraged from creating data visualizations that omit or distort information, because they can easily be misleading. However, the same representations that could be used to deceive can provide benefits when chosen to appropriately align with user tasks. We present an interaction technique, Perceptual Glimpses, which allows for the transparent presentation of so-called 'deceptive' views of information that are made temporary using quasimodes. When presented using Perceptual Glimpses, message-level exaggeration caused by a truncated axis on a bar chart was reduced under some conditions, but users require guidance to avoid errors, and view presentation order may affect trust. When Perceptual Glimpses was extended to display a range of views that might otherwise be deceptive or difficult to understand if shown out of context, users were able to understand and leverage these transformations to perform a range of low-level tasks. Design recommendations and examples suggest extensions of the technique."
192,You 'Might' Be Affected: An Empirical Analysis of Readability and Usability Issues in Data Breach Notifications,192,"Data breaches place affected individuals at significant risk of identity theft. Yet, prior studies have shown that many consumers do not take protective actions after receiving a data breach notification from a company. We analyzed 161 data breach notifications sent to consumers with respect to their readability, structure, risk communication, and presentation of potential actions. We find that notifications are long and require advanced reading skills. Many companies downplay or obscure the likelihood of the receiver being affected by the breach and associated risks. Moreover, potential actions and offered compensations are frequently described in lengthy paragraphs instead of clearly listed. Little information is provided regarding an action's urgency and effectiveness; little guidance is provided on which actions to prioritize. Based on our findings, we provide recommendations for designing more usable and informative data breach notifications that could help consumers better mitigate the consequences of being affected by a data breach."
193,Understanding Trust Transportation and Accessibility through Ridesharing,193,"Relatively few studies of accessibility and transportation for people with vision impairments have investigated forms of transportation besides public transportation and walking. To develop a more nuanced understanding of this context, we turn to ridesharing, an increasingly used mode of transportation. We interviewed 16 visually-impaired individuals about their active use of ridesharing services like Uber and Lyft. Our findings show that, while people with vision impairments value independence, ridesharing involves building trust across a complex network of stakeholders and technologies. This data is used to start a discussion on how other systems can facilitate trust for people with vision impairments by considering the role of conversation, affordances of system incentives, and increased agency."
194,Experimental Analysis of Barehand Mid-air Mode-Switching Techniques in Virtual Reality,194,"We present an empirical comparison of eleven bare hand, mid-air mode-switching techniques suitable for virtual reality in two experiments. The first evaluates seven techniques spanning dominant and non-dominant hand actions. Techniques represent common classes of actions selected by a methodical examination of 56 examples of prior art. The standard ""subtraction method"" protocol is adapted for 3D interfaces, with two baseline selection methods, bare hand pinch and device controller button. A second experiment with four techniques explores more subtle dominant-hand techniques and the effect of using a dominant hand device for selection. Results provide guidance to practitioners when choosing bare hand, mid-air mode-switching techniques, and for researchers when designing new mode-switching methods in VR."
195,Designing Interactive 3D Printed Models with Teachers of the Visually Impaired,195,"Students with visual impairments struggle to learn various concepts in the academic curriculum because diagrams, images, and other visual are not accessible to them. To address this, researchers have design interactive 3D printed models (I3Ms) that provide audio descriptions when a user touches components of a model. In prior work, I3Ms were designed on an ad hoc basis, and it is currently unknown what general guidelines produce effective I3M designs. To address this gap, we conducted two studies with Teachers of the Visually Impaired (TVIs). First, we led two design workshops with 35 TVIs, who modified sample models and added interactive elements to them. Second, we worked with three TVIs to design three I3Ms in an iterative instructional design process. At the end of this process, the TVIs used the I3Ms we designed to teach their students. We conclude that I3Ms should (1) have effective tactile features (e.g., distinctive patterns between components), (2) contain both auditory and visual content (e.g., explanatory animations), and (3) consider pedagogical methods (e.g., overview before details)."
196,Defending My Castle: A Co-Design Study of Privacy Mechanisms for Smart Homes,196,"Home is a person's castle, a private and protected space. Internet-connected devices such as locks, cameras, and speakers might make a home ""smarter"" but also raise privacy issues because these devices may constantly and inconspicuously collect, infer or even share information about people in the home. To explore user-centered privacy designs for smart homes, we conducted a co-design study in which we worked closely with diverse groups of participants in creating new designs. This study helps fill the gap in the literature between studying users' privacy concerns and designing privacy tools only by experts. Our participants' privacy designs often relied on simple strategies, such as data localization, disconnection from the Internet, and a private mode. From these designs, we identified six key design factors: data transparency and control, security, safety, usability and user experience, system intelligence, and system modality. We discuss how these factors can guide design for smart home privacy."
197,Understanding Perceptions of Problematic Facebook Use: When People Experience Negative Life Impact and a Lack of Control,197,"While many people use social network sites to connect with friends and family, some feel that their use is problematic, seriously affecting their sleep, work, or life. Pairing a survey of 20,000 Facebook users measuring perceptions of problematic use with behavioral and demographic data, we examined Facebook activities associated with problematic use as well as the kinds of people most likely to experience it. People who feel their use is problematic are more likely to be younger, male, and going through a major life event such as a breakup. They spend more time on the platform, particularly at night, and spend proportionally more time looking at profiles and less time browsing their News Feeds. They also message their friends more frequently. While they are more likely to respond to notifications, they are also more likely to deactivate their accounts, perhaps in an effort to better manage their time. Further, they are more likely to have seen content about social media or phone addiction. Notably, people reporting problematic use rate the site as more valuable to them, highlighting the complex relationship between technology use and well-being. A better understanding of problematic Facebook use can inform the design of context-appropriate and supportive tools to help people become more in control."
198,Typing on Split Keyboards with Peripheral Vision,198,"Split keyboards are widely used on hand-held touchscreen devices (e.g., tablets). However, typing on a split keyboard often requires eye movement and attention switching between two halves of the keyboard, which slows users down and increases fatigue. We explore peripheral typing, a superior typing mode in which a user focuses her visual attention on the output text and keeps the split keyboard in peripheral vision. Our investigation showed that peripheral typing reduced attention switching, enhanced user experience and increased overall performance (27 WPM, 28% faster) over the typical eyes-on typing mode. This typing mode can be well supported by accounting the typing behavior in statistical decoding. Based on our study results, we have designed GlanceType, a text entry system that supported both peripheral and eyes-on typing modes for real typing scenario. Our evaluation showed that peripheral typing not only well co-existed with the existing eyes-on typing, but also substantially improved the text entry performance. Overall, peripheral typing is a promising typing mode and supporting it would significantly improve the text entry performance on a split keyboard."
199,Mixed Reality Remote Collaboration Combining 360 Video and 3D Reconstruction,199,"Remote Collaboration using Virtual Reality (VR) and Augmented Reality (AR) has recently become a popular way for people from different places to work together. Local workers can collaborate with remote helpers by sharing 360-degree live video or 3D virtual reconstruction of their surroundings. However, each of these techniques has benefits and drawbacks. In this paper we explore mixing 360 video and 3D reconstruction together for remote collaboration, by preserving benefits of both systems while reducing drawbacks of each. We developed a hybrid prototype and conducted user study to compare benefits and problems of using 360 or 3D alone to clarify the needs for mixing the two, and also to evaluate the prototype system. We found participants performed significantly better on collaborative search tasks in 360 and felt higher social presence, yet 3D also showed potential to complement. Participant feedback collected after trying our hybrid system provided directions for improvement."
200,Decision-Making Under Uncertainty in Research Synthesis: Designing for the Garden of Forking Paths,200,"To make evidence-based recommendations to decision-makers, researchers conducting systematic reviews and meta-analyses must navigate a garden of forking paths: a series of analytical decision-points, each of which has the potential to influence findings. To identify challenges and opportunities related to designing systems to help researchers manage uncertainty around which of multiple analyses is best, we interviewed 11 professional researchers who conduct research synthesis to inform decision-making within three organizations. We conducted a qualitative analysis identifying 480 analytical decisions made by researchers throughout the scientific process. We present descriptions of current practices in applied research synthesis and corresponding design challenges: making it more feasible for researchers to try and compare analyses, shifting researchers' attention from rationales for decisions to impacts on results, and supporting communication techniques that acknowledge decision-makers' aversions to uncertainty. We identify opportunities to design systems which help researchers explore, reason about, and communicate uncertainty in decision-making about possible analyses in research synthesis."
201,ReType: Quick Text Editing with Keyboard and Gaze,201,"When a user needs to reposition the cursor during text editing, this is often done using the mouse. For experienced typists especially, the switch between keyboard and mouse can slow down the keyboard editing workflow considerably. To address this we propose ReType, a new gaze-assisted positioning technique combining keyboard with gaze input based on a new 'patching' metaphor. ReType allows users to perform some common editing operations while keeping their hands on the keyboard. We present the result of two studies. A free-use study indicated that ReType enhances the user experience of text editing. ReType was liked by many participants, regardless of their typing skills. A comparative user study showed that ReType is able to match or even beat the speed of mouse-based interaction for small text edits. We conclude that the gaze-augmented user interface can make common interactions more fluent, especially for professional keyboard users."
202,Desktop Electrospinning: A Single Extruder 3D Printer for Producing Rigid Plastic and Electrospun Textiles,202,"We present a new type of 3D printer that combines rigid plastic printing with melt electrospinning? a technique that uses electrostatic forces to create thin fibers from a molten polymer. Our printer enables custom-shaped textile sheets (similar in feel to wool felt) to be produced alongside rigid plastic using a single material (i.e., PLA) in a single process. We contribute open-source firmware, hardware specifications, and printing parameters to achieve melt electrospinning. Our approach offers new opportunities for fabricating interactive objects and sensors that blend the flexibility, absorbency and softness of produced electrospun textiles with the structure and rigidity of hard plastic for actuation, sensing, and tactile experiences."
203,Reading Face Reading Health: Exploring Face Reading Technologies for Everyday Health,203,"With the recent advancement in computer vision, Artificial Intelligence (AI), and mobile technologies, it has become technically feasible for computerized Face Reading Technologies (FRTs) to learn about one's health in everyday settings. However, how to design FRT-based applications for everyday health practices remains unexplored. This paper presents a design study with a technology probe called Faced, a mobile health checkup application based on the facial diagnosis method from Traditional Chinese Medicine (TCM). A field trial of Faced with 10 participants suggests potential usage modes and highlights a number of critical design issues in the use of FRTs for everyday health, including adaptability, practicality, sensitivity, and trustworthiness. We end by discussing design implications to address the unique challenges of fully integrating FRTs into everyday health practices."
204,Editing Spatial Layouts through Tactile Templates for People with Visual Impairments,204,"Spatial layout is a key component in graphic design. While people who are blind or visually impaired (BVI) can use screen readers or magnifiers to access digital content, these tools fail to fully communicate the content's graphic design information. Through semi-structured interviews and contextual inquiries, we identify the lack of this information and feedback as major challenges in understanding and editing layouts. Guided by these insights and a co-design process with a blind hobbyist web developer, we developed an interactive, multimodal authoring tool that lets blind people understand spatial relationships between elements and modify layout templates. Our tool automatically generates tactile print-outs of a web page's layout, which users overlay on top of a tablet that runs our self-voicing digital design tool. We conclude with design considerations grounded in user feedback for improving the accessibility of spatially encoded information and developing tools for BVI authors."
205,The Effect of Stereo Display Deficiencies on Virtual Hand Pointing,205,"The limitations of stereo display systems affect depth perception, e.g., due to the vergence-accommodation conflict or diplopia. We performed three studies to understand how stereo display deficiencies impact 3D pointing for targets in front of a screen and close to the user, i.e., in peripersonal space. Our first two experiments compare movements with and without a change in visual depth for virtual respectively physical targets. Results indicate that selecting targets along the depth axis is slower and has less throughput for virtual targets, while physical pointing demonstrates the opposite result. We then propose a new 3D extension for Fitts' law that models the effect of stereo display deficiencies. Next, our third experiment verifies the model and measures more broadly how the change in visual depth between targets affects pointing performance in peripersonal space and confirms significant effects on time and throughput. Finally, we discuss implications for 3D user interface design."
206,Effects of Local Latency on Game Pointing Devices and Game Pointing Tasks,206,"Studies have shown certain game tasks such as targeting to be negatively and significantly affected by latencies as low as 41ms. Therefore it is important to understand the relationship between local latency - delays between an input action and resulting change in the display - and common gaming tasks such as targeting and tracking. In addition, games now use a variety of input devices, including touchscreens, mice, tablets and controllers. These devices provide very different combinations of direct/indirect input, absolute/relative movement, and position/rate control, and are likely to be affected by latency in different ways. We performed a study evaluating and comparing the effects of latency across four devices (touchscreen, mouse, controller and drawing tablet) on targeting and interception tasks. We analyze both throughput and path characteristics, identify differences between devices, and provide design considerations for game designers."
207,Chatbots Humbots and the Quest for Artificial General Intelligence,207,"What began as a quest for artificial general intelligence branched into several pursuits, including intelligent assistants developed by tech companies and task-oriented chatbots that deliver more information or services in specific domains. Progress quickened with the spread of low-latency networking, then accelerated dramatically a few years ago. In 2016, task-focused chatbots became a centerpiece of machine intelligence, promising interfaces that are more engaging than robotic answering systems and that can accommodate our increasingly phone-based information needs. Hundreds of thousands were built. Creating successful non-trivial chatbots proved more difficult than anticipated. Some developers now design for human-chatbot (humbot) teams, with people handling difficult queries. This paper describes the conversational agent space, difficulties in meeting user expectations, potential new design approaches, uses of human-bot hybrids, and implications for the ultimate goal of creating software with general intelligence."
208,Haptic Navigation Cues on the Steering Wheel,208,"Haptic feedback is used in cars to reduce visual inattention. While tactile feedback like vibration can be influenced by the car's movement, thermal and cutaneous push feedback should be independent of such interference. This paper presents two driving simulator studies investigating novel tactile feedback on the steering wheel for navigation. First, devices on one side of the steering wheel were warmed, indicating the turning direction, while those on the other side were cooled. This thermal feedback was compared to audio. The thermal navigation lead to 94.2% correct recognitions of warnings 200m before the turn and to 91.7% correct turns. Speech had perfect recognition for both. In the second experiment, only the destination side was indicated thermally, and this design was compared to cutaneous push feedback. The simplified thermal feedback design did not increase recognition, but cutaneous push feedback had high recognition rates (100% for 200 m warnings, 98% for turns)."
209,Drag:on: A Virtual Reality Controller Providing Haptic Feedback Based on Drag and Weight Shift,209,"Standard controllers for virtual reality (VR) lack sophisticated means to convey a realistic, kinesthetic impression of size, resistance or inertia. We present the concept and implementation of Drag:on, an ungrounded shape-changing VR controller that provides dynamic passive haptic feedback based on drag, i.e. air resistance, and weight shift. Drag:on leverages the airflow occurring at the controller during interaction. By dynamically adjusting its surface area, the controller changes the drag and rotational inertia felt by the user. In a user study, we found that Drag:on can provide distinguishable levels of haptic feedback. Our prototype increases the haptic realism in VR compared to standard controllers and when rotated or swung improves the perception of virtual resistance. By this, Drag:on provides haptic feedback suitable for rendering different virtual mechanical resistances, virtual gas streams, and virtual objects differing in scale, material and fill state."
210,ForceRay: Extending Thumb Reach via Force Input Stabilizes Device Grip for Mobile Touch Input,210,"Smartphones are used predominantly one-handed, using the thumb for input. Many smartphones, however, have grown beyond 5"". Users cannot tap everywhere on these screens without destabilizing their grip. ForceRay (FR) lets users aim at an out-of-reach target by applying a force touch at a comfortable thumb location, casting a virtual ray towards the target. Varying pressure moves a cursor along the ray. When reaching the target, quickly lifting the thumb selects it. In a first study, FR was 195 ms slower and had a 3% higher selection error than the best existing technique, BezelCursor (BC), but FR caused significantly less device movement than all other techniques, letting users maintain a steady grip and removing their concerns about device drops. A second study showed that an hour of training speeds up both BC and FR, and that both are equally fast for targets at the screen border."
211,Understanding and Modeling User-Perceived Brand Personality from Mobile Application UIs,211,"Designers strive to make their mobile apps stand out in a competitive market by creating a distinctive brand personality. However, it is unclear whether users can form a consistent impression of brand personality by looking at a few user interface (UI) screenshots in the app store, and if this process can be modeled computationally. To bridge this gap, we first collect crowd assessment on brand personalities depicted by the UIs of 318 applications, and statistically confirm that users can reach substantial agreement. To further model how users process mobile UI visually, we compute UI descriptors including Color, Organization, and Texture at both element and page levels. We feed these descriptors to a computational model, achieving a high accuracy of predicting perceived brand personality (MSE = 0.035 and R^2 = 0.78). This work could benefit designers by highlighting contributing visual factors to brand personality creation and providing quick, low-cost design feedback."
