ID,Title,ID,Abstract
518,Automation Accuracy Is Good but High Controllability May Be Better,518,"When automating tasks using some form of artificial intelligence, some inaccuracy in the result is virtually unavoidable. In many cases, the user must decide whether to try the automated method again, or fix it themselves using the available user interface. We argue this decision is influenced by both perceived automation accuracy and degree of task ""controllability"" (how easily and to what extent an automated result can be manually modified). This relationship between accuracy and controllability is investigated in a 750-participant crowdsourced experiment using a controlled, gamified task. With high controllability, self-reported satisfaction remained constant even under very low accuracy conditions, and overall, a strong preference was observed for using manual control rather than automation, despite much slower performance and regardless of very poor controllability."
519,Gehna: Exploring the Design Space of Jewelry as an Input Modality,519,"Jewelry weaves into our everyday lives as no other wearable does. It comes in many wearable forms, is fashionable, and can adorn any part of the body. In this paper, through an exploratory, Research through Design (RtD) process, we tap into this vast potential space of input interaction that jewelry can enable. We do so by first identifying a small set of fundamental structural elements --- called Jewelements --- that any jewelry is composed of, and then defining their properties that enable the interaction. We leverage this synthesis along with observational data and literature to formulate a design space of jewelry-enabled input techniques. This work encapsulates both the extensions of common existing input methods (e.g., touch) as well as new ones inspired by jewelry. Furthermore, we discuss our prototypical sensor-based implementations. Through this work, we invite the community to engage in the conversation on how jewelry as a material can help shape wearable-based input."
520,I'm a Giant: Walking in Large Virtual Environments at High Speed Gains,520,"Advances in tracking technology and wireless headsets enable walking as a means of locomotion in Virtual Reality. When exploring virtual environments larger than room-scale, it is often desirable to increase users' perceived walking speed, for which we investigate three methods. (1) Ground-Level Scaling increases users' avatar size, allowing them to walk farther. (2) Eye-Level Scaling enables users to walk through a World in Miniature, while maintaining a street-level view. (3) Seven-League Boots amplifies users' movements along their walking path. We conduct a study comparing these methods and find that users feel most embodied using Ground-Level Scaling and consequently increase their stride length. Using Seven-League Boots, unlike the other two methods, diminishes positional accuracy at high gains, and users modify their walking behavior to compensate for the lack of control. We conclude with a discussion on each technique's strength and weaknesses and the types of situation they might be appropriate for."
521,Understanding the Impact of Information Representation on Willingness to Share Information,521,"Since the release of the first activity tracker, there has been a steady increase in the number of sensors embedded in wearable devices and with it in the amount and diversity of information that can be derived from these sensors. This development leads to novel privacy threats for users. In a web survey with 248 participants, we explored whether users' willingness to share private data is dependent on how the data is requested by an application. Specifically, requests can be formulated as access to sensor data or as access to information derived from the sensor data (e.g., accelerometer vs. sleep quality). We show that non-expert users lack an understanding of how the two representation levels relate to each other. The results suggest that the willingness to share sensor data over derived information is governed by whether the derived information has positive or negative connotations (e.g., training intensity vs. life expectancy). Using the results of the survey, we derive implications for supporting users in protecting their private data collected via wearable sensors."
522,The Impact of Web Browser Reader Views on Reading Speed and User Experience,522,"As reading increasingly shifts from paper to online media, many web browsers now provide a ""Reader View,'' which modifies web page layout and design for better readability. However, research has yet to establish whether Reader Views are effective in improving readability and how they might change the user experience. We characterize how Mozilla Firefox's Reader View significantly reduces the visual complexity of websites by excluding menus, images, and content. We then conducted an online study with 391 participants (including 42 who self-reported having been diagnosed with dyslexia), showing that compared to standard websites the Reader View increased reading speed by 5% for readers on average, and significantly improved perceived readability and visual appeal. We suggest guidelines for the design of websites and browsers that better support people with varying reading skills."
523,Does Being Verified Make You More Credible? Account Verification's Effect on Tweet Credibility,523,"Many popular social networking and microblogging sites support verified accounts---user accounts that are deemed of public interest and whose owners have been authenticated by the site. Importantly, the content of messages contributed by verified account owners is not verified. Such messages may be factually correct, or not. This paper investigates whether users confuse authenticity with credibility by posing the question: Are users more likely to believe content from verified accounts than from non-verified accounts? We conduct two online studies, a year apart, with 748 and 2041 participants respectively, to assess how the presence or absence of verified account indicators influences users' perceptions of tweets. Surprisingly, across both studies, we find that---in the context of unfamiliar accounts---most users can effectively distinguish between authenticity and credibility. The presence or absence of an authenticity indicator has no significant effect on willingness to share a tweet or take action based on its contents."
524,Does Who Matter? Studying the Impact of Relationship Characteristics on Receptivity to Mobile IM Messages,524,"This study examines the characteristics of mobile instant-messaging users' relationships with their social contacts and the effects of both relationship and interruption context on four measures of receptivity: Attentiveness, Responsiveness, Interruptibility, and Opportuneness. Overall, interruption context overshadows relationship characteristics as predictors of all four of these facets of receptivity; this overshadowing was most acute for Interruptibility and Opportuneness, but existed for all factors. In addition, while Mobile Maintenance Expectation and Activity Engagement were negatively correlated with all receptivity measures, each such measure had its own set of predictors, highlighting the conceptual differences among the measures. Finally, delving more deeply into potential relationship effects, we found that a single, simple closeness question was as effective at predicting receptivity as the 12-item Unidimensional Relationship Closeness Scale."
525,#HandsOffMyADA: A Twitter Response to the ADA Education and Reform Act,525,"Twitter continues to be used increasingly for communication related advocacy, activism, and social change. This is also the case for the disability community. In light of the recently proposed ADA Education and Reform in the United States, we investigate factors for effectiveness of sharing or retweeting messages about topics affecting the rights of people with disabilities. We perform a multifaceted study of the #HandsOffMyADA campaign against the proposed H.R.620 bill to: (1) explore how communication via Twitter compares to previous disability rights movements; (2) characterize the campaign in terms of hashtags, user groups, and content such as accessible multimedia that contribute to dissemination of campaign messages; (3) identify major themes in tweets and responses, and their variation among user groups; and (4) understand how the disability community mobilized for this campaign compared to previous Twitter initiatives."
526,Poirot: A Web Inspector for Designers,526,"To better understand the issues designers face as they interact with developers and use developer tools to create websites, we conducted a formative investigation consisting of interviews, a survey, and an analysis of professional design documents. Based on insights gained from these efforts, we developed Poirot, a web inspection tool for designers that enables them to make style edits to websites using a familiar graphical interface. We compared Poirot to Chrome DevTools in a lab study with 16 design professionals. We observed common problems designers experience when using Chrome DevTools and found that when using Poirot, designers were more successful in accomplishing typical design tasks (97% to 63%). In addition, we found that Poirot had a significantly lower perceived cognitive load and was overwhelmingly preferred by the designers in our study."
527,Understanding and Designing for Deaf or Hard of Hearing Drivers on Uber,527,"We used content analysis of in-app driver survey responses, customer support tickets, and tweets, and face-to-face interviews of DHH Uber drivers to better understand the DHH driver experience. Here we describe challenges DHH drivers experience and how they address those difficulties via Ubers accessibility features and their own workarounds. We also identify and discuss design and product opportunities to improve the DHH driver experience on Uber."
528,Street-Level Algorithms: A Theory at the Gaps Between Policy and Decisions,528,"Errors and biases are earning algorithms increasingly malignant reputations in society. A central challenge is that algorithms must bridge the gap between high-level policy and on-the-ground decisions, making inferences in novel situations where the policy or training data do not readily apply. In this paper, we draw on the theory ofstreet-level bureaucracies,how human bureaucrats such as police and judges interpret policy to make on-the-ground decisions. We present by analogy a theory ofstreet-level algorithms,the algorithms that bridge the gaps between policy and decisions about people in a socio-technical system. We argue that unlike street-level bureaucrats, who reflexively refine their decision criteria as they reason through a novel situation, street-level algorithms at best refine their criteria only after the decision is made. This loop-and-a-half delay results in illogical decisions when handling new or extenuating circumstances. This theory suggests designs for street-level algorithms that draw on historical design patterns for street-level bureaucracies, including mechanisms for self-policing and recourse in the case of error."
529,Cicero: Multi-Turn Contextual Argumentation for Accurate Crowdsourcing,529,"Traditional approaches for ensuring high quality crowdwork have failed to achieve high-accuracy on difficult problems. Aggregating redundant answers often fails on the hardest problems when the majority is confused. Argumentation has been shown to be effective in mitigating these drawbacks. However, existing argumentation systems only support limited interactions and show workers general justifications, not context-specific arguments targeted to their reasoning. This paper presents Cicero, a new workflow that improves crowd accuracy on difficult tasks by engaging workers in multi-turn, contextual discussions through real-time, synchronous argumentation. Our experiments show that compared to previous argumentation systems which only improve the average individual worker accuracy by 6.8 percentage points on the Relation Extraction domain, our workflow achieves 16.7 percentage point improvement. Furthermore, previous argumentation approaches don't apply to tasks with many possible answers; in contrast, Cicero works well in these cases, raising accuracy from 66.7% to 98.8% on the Codenames domain."
530,Personalising the TV Experience using Augmented Reality: An Exploratory Study on Delivering Synchronised Sign Language Interpretation,530,"Augmented Reality (AR) technology has the potential to extend the screen area beyond the rigid frames of televisions. The additional display area can be used to augment televisions (TVs) with extra information tailored to individuals, for instance, the provision of access services like sign language interpretations. We invited 23 (11 in the UK, 12 in Germany) users of signed content to evaluate three methods of watching a sign language interpreted programme - one traditional in-vision method with signed programme content on TV and two AR-enabled methods in which an AR sign language interpreter (a 'half-body' version and a 'full-body' version) is projected just outside the frame of the TV presenting the programme. In the UK, participants were split 3-ways in their preferences while in Germany, half the participants preferred the traditional method followed closely by the 'half-body' version. We discuss our participants reasoning behind their preferences and implications for future research."
531,FTVR in VR: Evaluation of 3D Perception With a Simulated Volumetric Fish-Tank Virtual Reality Display,531,"Spherical fish tank virtual reality (FTVR) displays attempt to create a virtual ""crystal ball"" experience using head-tracked rendering. Almost all of these systems have omitted stereo cues, making them easy to build, but it is not clear how much this omission degrades the 3D experience. In this study, we evaluate performance and subjective effects of stereo on 3D perception and interaction tasks with a spherical FTVR display. To control for calibration error and tracking latency, we perform the evaluation on a simulated spherical display in VR. The results of our study provide a clear recommendation for the design and use of spherical FTVR displays: while omitting stereo may not be readily apparent for users, their performance will be significantly degraded (20% - 91% increase in median task time). Therefore, including stereo viewing in spherical displays is critical for use in FTVR."
532,Exploring How Privacy and Security Factor into IoT Device Purchase Behavior,532,"Despite growing concerns about security and privacy of Internet of Things (IoT) devices, consumers generally do not have access to security and privacy information when purchasing these devices. We interviewed 24 participants about IoT devices they purchased. While most had not considered privacy and security prior to purchase, they reported becoming concerned later due to media reports, opinions shared by friends, or observing unexpected device behavior. Those who sought privacy and security information before purchase, reported that it was difficult or impossible to find. We asked interviewees to rank factors they would consider when purchasing IoT devices; after features and price, privacy and security were ranked among the most important. Finally, we showed interviewees our prototype privacy and security label. Almost all found it to be accessible and useful, encouraging them to incorporate privacy and security in their IoT purchase decisions."
533,An Explanation of Fitts' Law-like Performance in Gaze-Based Selection Tasks Using a Psychophysics Approach,533,"Eye gaze as an input method has been studied since the 1990s, to varied results: some studies found gaze to be more efficient than traditional input methods like a mouse, others far behind. Comparisons are often backed up by Fitts' Law without explicitly acknowledging the ballistic nature of saccadic eye movements. Using a vision science-inspired model, we here show that a Fitts'-like distribution of movement times can arise due to the execution of secondary saccades, especially when targets are small. Study participants selected circular targets using gaze. Seven different target sizes and two saccade distances were used. We then determined performance across target sizes for different sampling windows (""dwell times"") and predicted an optimal dwell time range. Best performance was achieved for large targets reachable by a single saccade. Our findings highlight that Fitts' Law, while a suitable approximation in some cases, is an incomplete description of gaze interaction dynamics."
534,MultiTrack: Multi-User Tracking and Activity Recognition Using Commodity WiFi,534,"This paper presents MultiTrack, a commodity WiFi based human sensing system that can track multiple users and recognize activities of multiple users performing them simultaneously. Such a system can enable easy and large-scale deployment for multi-user tracking and sensing without the need for additional sensors through the use of existing WiFi devices (e.g., desktops, laptops and smart appliances). The basic idea is to identify and extract the signal reflection corresponding to each individual user with the help of multiple WiFi links and all the available WiFi channels at 5GHz. Given the extracted signal reflection of each user, MultiTrack examines the path of the reflected signals at multiple links to simultaneously track multiple users. It further reconstructs the signal profile of each user as if only a single user has performed activity in the environment to facilitate multi-user activity recognition. We evaluate MultiTrack in different multipath environments with up to 4 users for multi-user tracking and up to 3 users for activity recognition. Experimental results show that our system can achieve decimeter localization accuracy and over 92% activity recognition accuracy under multi-user scenarios."
535,What is Mixed Reality?,535,"What is Mixed Reality (MR)? To revisit this question given the many recent developments, we conducted interviews with ten AR/VR experts from academia and industry, as well as a literature survey of 68 papers. We find that, while there are prominent examples, there is no universally agreed on, one-size-fits-all definition of MR. Rather, we identified six partially competing notions from the literature and experts' responses. We then started to isolate the different aspects of reality relevant for MR experiences, going beyond the primarily visual notions and extending to audio, motion, haptics, taste, and smell. We distill our findings into a conceptual framework with seven dimensions to characterize MR applications in terms of the number of environments, number of users, level of immersion, level of virtuality, degree of interaction, input, and output. Our goal with this paper is to support classification and discussion of MR applications' design and provide a better means to researchers to contextualize their work within the increasingly fragmented MR landscape."
536,Machine Heuristic: When We Trust Computers More than Humans with Our Personal Information,536,"In this day and age of identity theft, are we likely to trust machines more than humans for handling our personal information? We answer this question by invoking the concept of ""machine heuristic,"" which is a rule of thumb that machines are more secure and trustworthy than humans. In an experiment (N = 160) that involved making airline reservations, users were more likely to reveal their credit card information to a machine agent than a human agent. We demonstrate that cues on the interface trigger the machine heuristic by showing that those with higher cognitive accessibility of the heuristic (i.e., stronger prior belief in the rule of thumb) were more likely than those with lower accessibility to disclose to a machine, but they did not differ in their disclosure to a human. These findings have implications for design of interface cues conveying machine vs. human sources of our online interactions."
537,Critter: Augmenting Creative Work with Dynamic Checklists Automated Quality Assurance and Contextual Reviewer Feedback,537,"Checklists and guidelines have played an increasingly important role in complex tasks ranging from the cockpit to the operating theater. Their role in creative tasks like design is less explored. In a needfinding study with expert web designers, we identified designers' challenges in adhering to a checklist of design guidelines. We built Critter, which addressed these challenges with three components: Dynamic Checklists that progressively disclose guideline complexity with a self-pruning hierarchical view, AutoQA to automate common quality assurance checks, and guideline-specific feedback provided by a reviewer to highlight mistakes as they appear. In an observational study, we found that the more engaged a designer was with Critter, the fewer mistakes they made in following design guidelines. Designers rated the AutoQA and contextual feedback experience highly, and provided feedback on the tradeoffs of the hierarchical Dynamic Checklists. We additionally found that a majority of designers rated the AutoQA experience as excellent and felt that it increased the quality of their work. Finally, we discuss broader implications for supporting complex creative tasks."
538,Do People Consume the News they Trust?: Incidental News Usage and the High-Choice Media Environment,538,"It is reasonable to expect trusted news organizations to have more engaged users. However, given the lowest levels of trust in media and the several intermediaries involved in digital news consumption, recent studies posit that trust and usage may not be related. We argue that while trust may not relate to overall news usage, given that much of it is incidental, but it could still explain intentional usage. We correlated passively metered usage from digital trace data on 35 national news outlets in the US with their trustworthiness from a nationally representative survey, for three discrete months. We find no association between trust and overall user engagement, but a positive relationship between trustworthiness and direct visits, the latter a measure of intentional usage. These relationships held for outlets despite their partisan leanings, multi-platform presence and their mainstream nature."
539,Saliency Deficit and Motion Outlier Detection in Animated Scatterplots,539,"We report the results of a crowdsourced experiment that measured the accuracy of motion outlier detection in multivariate, animated scatterplots. The targets were outliers either in speed or direction of motion, and were presented with varying levels of saliency in dimensions that are irrelevant to the task of motion outlier detection (e.g., color, size, position). We found that participants had trouble finding the outlier when it lacked irrelevant salient features and that visual channels contribute unevenly to the odds of an outlier being correctly detected. Direction of motion contributes the most to accurate detection of speed outliers, and position contributes the most to accurate detection of direction outliers. We introduce the concept of saliency deficit in which item importance in the data space is not reflected in the visualization due to a lack of saliency. We conclude that motion outlier detection is not well supported in multivariate animated scatterplots."
540,Understanding Affective Experiences with Conversational Agents,540,"While previous studies of Conversational Agents (e.g. Siri, Google Assistant, Alexa and Cortana) have focused on evaluating usability and exploring capabilities of these systems, little work has examined users' affective experiences. In this paper we present a survey study with 171 participants to examine CA users' affective experiences. Specifically, we present four major usage scenarios, users' affective responses in these scenarios, and the factors which influenced the affective responses. We found that users' overall experience was positive with interest being the most salient positive emotion. Affective responses differed depending on the scenarios. Both pragmatic and hedonic qualities influenced affect. The factors underlying pragmatic quality are: helpfulness, proactivity, fluidity, seamlessness and responsiveness. The factors underlying hedonic quality are: comfort in human-machine conversation, pride of using cutting-edge technology, fun during use, perception of having a human-like assistant, concern about privacy and fear of causing distraction."
541,Rehumanized Crowdsourcing: A Labeling Framework Addressing Bias and Ethics in Machine Learning,541,"The increased use of machine learning in recent years led to large volumes of data being manually labeled via crowdsourcing microtasks completed by humans. This brought about dehumanization effects, namely, when task requesters overlook the humans behind the task, leading to issues of ethics (e.g., unfair payment) and amplification of human biases, which are transferred into training data and affect machine learning in the real world. We propose a framework that allocates microtasks considering human factors of workers such as demographics and compensation. We deployed our framework to a popular crowdsourcing platform and conducted experiments with 1,919 workers collecting 160,345 human judgments. By routing microtasks to workers based on demographics and appropriate pay, our framework mitigates biases in the contributor sample and increases the hourly pay given to contributors. We discuss potential extensions and how it can promote transparency in crowdsourcing."
