ID,Title,ID,Abstract
354,Witchcraft and HCI: Morality,354,"While Human-Computer Interaction (HCI) research on health and well-being is increasingly becoming more aware and inclusive of its social and political dimensions, spiritual practices are still largely overlooked there. For a large number of people around the world, especially in the global south, witchcraft, sorcery, and other occult practices are the primary means of achieving health, wealth, satisfaction, and happiness. Building on an eight-month long ethnography in six villages in Jessore, Bangladesh, this paper explores the knowledge, materials, and politics involved in the local witchcraft practices there. By drawing from a rich body of anthropological work on witchcraft, this paper discusses how those findings contribute to the broader issues in HCI around morality, modernity, and postcolonial computing. This paper concludes by recommending ways for smooth integration of traditional occult practices with HCI through design and policy. We argue for occult practices as an under-appreciated site for HCI to learn how to combat ideological hegemony."
355,QuizBot: A Dialogue-based Adaptive Learning System for Factual Knowledge,355,"Advances in conversational AI have the potential to enable more engaging and effective ways to teach factual knowledge. To investigate this hypothesis, we created QuizBot, a dialogue-based agent that helps students learn factual knowledge in science, safety, and English vocabulary. We evaluated QuizBot with 76 students through two within-subject studies against a flashcard app, the traditional medium for learning factual knowledge. Though both systems used the same algorithm for sequencing materials, QuizBot led to students recognizing (and recalling) over 20% more correct answers than when students used the flashcard app. Using a conversational agent is more time consuming to practice with, but in a second study, of their own volition, students spent 2.6x more time learning with QuizBot than with flashcards and reported preferring it strongly for casual learning. Our results in this second study showed QuizBot yielded improved learning gains over flashcards on recall. These results suggest that educational chatbot systems may have beneficial use, particularly for learning outside of traditional settings."
356,The Adventures of Older Authors: Exploring Futures through Co-Design Fictions,356,"This paper presents co-design fiction as an approach to engaging users in imagining, envisioning and speculating not just on future technology but future life through co-created fictional works. Design fiction in research is often created or written by researchers. There is relatively little critical discussion of how to co-create design fictions with end-users, with the concomitant opportunities and challenges this poses. To fill this gap in knowledge, we conducted co-design fiction workshops with nine older creative writers, utilising prompts to inspire discussion and engage their imaginative writing about the trend towards tracking and monitoring older people. Their stories revealed futures of neither dystopia nor utopia but of social and moral dilemmas narrating their wish not just to ""maintain their independence"", but a palpable desire for adventure and very nuanced senses of how they wish to take control. We discuss inherent tensions in the control of the co-design fiction process; balancing the author's need for freedom and creativity with the researcher's desire to guide the process toward the design investigation at hand."
357,Beyond The Force: Using Quadcopters to Appropriate Objects and the Environment for Haptics in Virtual Reality,357,"Quadcopters have been used as hovering encountered-type haptic devices in virtual reality. We suggest that quadcopters can facilitate rich haptic interactions beyond force feedback by appropriating physical objects and the environment. We present HoverHaptics, an autonomous safe-to-touch quadcopter and its integration with a virtual shopping experience. HoverHaptics highlights three affordances of quadcopters that enable these rich haptic interactions: (1) dynamic positioning of passive haptics, (2) texture mapping, and (3) animating passive props. We identify inherent challenges of hovering encountered-type haptic devices, such as their limited speed, inadequate control accuracy, and safety concerns. We then detail our approach for tackling these challenges, including the use of display techniques, visuo-haptic illusions, and collision avoidance. We conclude by describing a preliminary study (n = 9) to better understand the subjective user experience when interacting with a quadcopter in virtual reality using these techniques."
358,Using Presence Questionnaires in Virtual Reality,358,"Virtual Reality (VR) is gaining increasing importance in science, education, and entertainment. A fundamental characteristic of VR is creating presence, the experience of 'being' or 'acting', when physically situated in another place. Measuring presence is vital for VR research and development. It is typically repeatedly assessed through questionnaires completed after leaving a VR scene. Requiring participants to leave and re-enter the VR costs time and can cause disorientation. In this paper, we investigate the effect of completing presence questionnaires directly in VR. Thirty-six participants experienced two immersion levels and filled three standardized presence questionnaires in the real world or VR. We found no effect on the questionnaires' mean scores; however, we found that the variance of those measures significantly depends on the realism of the virtual scene and if the subjects had left the VR. The results indicate that, besides reducing a study's duration and reducing disorientation, completing questionnaires in VR does not change the measured presence but can increase the consistency of the variance."
359,Understanding the Social Acceptability of Mobile Devices using the Stereotype Content Model,359,"Understanding social perception is important for designing mobile devices that are socially acceptable. Previous work not only investigated the social acceptability of mobile devices and interaction techniques but also provided tools to measure social acceptance. However, we lack a robust model that explains the underlying factors that make devices socially acceptable. In this paper, we consider mobile devices as social objects and investigate if the stereotype content model (SCM) can be applied to those devices. Through a study that assesses combinations of mobile devices and group stereotypes, we show that mobile devices have a systematic effect on the stereotypes' warmth and competence. Supported by a second study, which combined mobile devices without a specific stereotypical user, our result suggests that mobile devices are perceived stereotypically by themselves. Our combined results highlight mobile devices as social objects and the importance of considering stereotypes when assessing social acceptance of mobile devices."
360,Anchoring Effects and Troublesome Asymmetric Transfer in Subjective Ratings,360,"Within-subjects experiments are prone to asymmetric transfer, which confounds results interpretation. While HCI researchers routinely test asymmetric transfer in objective data, doing so for subjective data is rare. Yet literature suggests that anchoring effects should make subjective measures particularly susceptible to asymmetric transfer. We report on four analyses of NASA-TLX data from four previously published HCI papers, with four main findings. First, asymmetric transfer is common, occurring in 42% of tests analysed. Second, the data conforms to predictions of anchoring effects. Third, the magnitude of the anchor's effect correlates with the magnitude of the difference between the interface ratings -- that is, the anchor's 'pull' correlates with the anchoring stimulus. Fourth, several of the previously published findings are changed when data are reanalysed using between-subjects treatment. We urge caution when analysing within-subjects subjective measures and recommend that researchers test for and report the occurrence of asymmetric transfer."
361,Aggregated Visualization of Playtesting Data,361,"Playtesting is a key component in the game development process aimed at improving the quality of games through the collection of gameplay data and identification of design issues. Visualization techniques are currently being employed to help integrate quantitative and qualitative data. Despite that, two existing challenges are to determine the level of detail to be presented to developers based on their needs and to effectively communicate the collected data so that informed design changes can be reached. In this paper, we first propose an aggregated visualization technique that makes use of clustering, territory tessellation, and trajectory aggregation to simultaneously display mixed playtesting data. Secondly, to assess the usefulness of our technique we evaluate it through interviews with professional game developers and compare it to a non-aggregated visualization. The results of this study also provide an important contribution towards identifying areas of improvement in the portrayal of gameplay data."
362,Look-From Camera Control for 3D Terrain Maps,362,"We introduce three lightweight interactive camera control techniques for 3D terrain maps on touch devices based on a look-from metaphor (Discrete Look-From-At, Continuous Look-From-Forwards, and Continuous Look-From-Towards). These techniques complement traditional touch screen pan, zoom, rotate, and pitch controls allowing viewers to quickly transition between top-down, oblique, and ground-level views. We present the results of a study in which we asked participants to perform elevation comparison and line-of-sight determination tasks using each technique. Our results highlight how look-from techniques can be integrated on top of current direct manipulation navigation approaches by combining several direct manipulation operations into a single look-from operation. Additionally, they show how look-from techniques help viewers complete a variety of common and challenging map-based tasks."
363,ZeRONE: Safety Drone with Blade-Free Propulsion,363,"We present ZeRONE, a new indoor drone that does not use rotating blades for propulsion. The proposed device is a helium blimp type drone that uses the wind generated by the ultrasonic vibration of piezo elements for propulsion. Compared to normal drones with rotating propellers, the drone is much safer because its only moving parts are the piezo elements whose surfaces vibrate at the order of micrometers. The drone can float for a few weeks and the ultrasonic propulsion system is quiet. We implement a prototype of the drone and evaluate its performance and unique characteristics in experiments. Moreover, application scenarios in which ZeRONE coexists with people are also discussed."
364,Beyond the Patient Portal: Supporting Needs of Hospitalized Patients,364,"Although patient portals-technologies that give patients access to their health information-are recognized as key to increasing patient engagement, we have a limited understanding of how these technologies should be designed to meet the needs of hospitalized patients and caregivers. Through semi-structured interviews with 30 patients and caregivers, we examine how future patient portals can best align with their needs and support engagement in their care. Our findings reveal six needs that existing patient portals do not support: (1) transitioning from home to hospital, (2) adjusting schedules and receiving status updates, (3) understanding and remembering care, (4) asking questions and flagging problems, (5) collaborating with providers and care- givers, and (6) preparing for discharge and at-home care. Based on these findings, we discuss three design implications: highlight patient-centric goals and preferences, provide dynamic information about care events, and design for situationally-impaired users. Our contributions guide future patient portals in engaging hospitalized patients and care- givers as primary stakeholders in their health care."
365,Can Privacy Be Satisfying? On Improving Viewer Satisfaction for Privacy-Enhanced Photos Using Aesthetic Transforms,365,"Pervasive photo sharing in online social media platforms can cause unintended privacy violations when elements of an image reveal sensitive information. Prior studies have identified image obfuscation methods (e.g., blurring) to enhance privacy, but many of these methods adversely affect viewers' satisfaction with the photo, which may cause people to avoid using them. In this paper, we study the novel hypothesis that it may be possible to restore viewers' satisfaction by 'boosting' or enhancing the aesthetics of an obscured image, thereby compensating for the negative effects of a privacy transform. Using a between-subjects online experiment, we studied the effects of three artistic transformations on images that had objects obscured using three popular obfuscation methods validated by prior research. Our findings suggest that using artistic transformations can mitigate some negative effects of obfuscation methods, but more exploration is needed to retain viewer satisfaction."
366,An Analytic Model for Time Efficient Personal Hierarchies,366,"Hierarchy structures such as file systems are widespread interfaces for item retrieval and selection tasks. Some hierarchies can be modified by end-users, such as application launchers on smartphones or pictures in a file folder. These modifiable hierarchies cannot benefit from an optimization made beforehand as their content, unknown during the design process, is constantly evolving. We hence propose an analytic model which designers can integrate in their system to recommend a range of local structure modifications (e.g., creating new folders) to end-users. Proposing a range of modifications gives flexibility to end-users regarding their own meaningful grouping and labeling choices to follow a recommendation. A first experiment confirms that the recommendations built on our model can lead to modified hierarchies resulting in faster theoretical selection times. A second experiment confirms that the theoretical selection times fit empirical selection times in different hierarchy visual layouts: linear, radial, and grid."
367,Geppetto: Enabling Semantic Design of Expressive Robot Behaviors,367,"Expressive robots are useful in many contexts, from industrial to entertainment applications. However, designing expressive robot behaviors requires editing a large number of unintuitive control parameters. We present an interactive, data-driven system that allows editing of these complex parameters in a semantic space. Our system combines a physics-based simulation that captures the robot's motion capabilities, and a crowd-powered framework that extracts relationships between the robot's motion parameters and the desired semantic behavior. These relationships enable mixed-initiative exploration of possible robot motions. We specifically demonstrate our system in the context of designing emotionally expressive behaviors. A user-study finds the system to be useful for more quickly developing desirable robot behaviors, compared to manual parameter editing."
368,Personal Health Oracle: Explorations of Personalized Predictions in Diabetes Self-Management,368,"The increasing availability of health data and knowledge about computationally modeling human physiology opens new opportunities for personalized predictions in health. Yet little is known about how individuals interact and reason with personalized predictions. To explore these questions, we developed a smartphone app, GlucOracle, that uses self-tracking data of individuals with type 2 diabetes to generate personalized forecasts for post-meal blood glucose levels. We pilot-tested GlucOracle with two populations: members of an online diabetes community, knowledgeable about diabetes and technologically savvy; and individuals from a low socio-economic status community, characterized by high prevalence of diabetes, low literacy and limited experience with mobile apps. Individuals in both communities engaged with personal glucose forecasts and found them useful for adjusting immediate meal options, and planning future meals. However, the study raised new questions as to appropriate time, form, and focus of forecasts and suggested new research directions for personalized predictions in health."
369,Exploring Factors that Influence Connected Drivers to (Not) Use or Follow Recommended Optimal Routes,369,"Navigation applications are becoming ubiquitous in our daily navigation experiences. With the intention to circumnavigate congested roads, their route guidance always follows the basic assumption that drivers always want the fastest route. However, it is unclear how their recommendations are followed and what factors affect their adoption. We present the results of a semi-structured qualitative study with 17 drivers, mostly from the Philippines and Japan. We recorded their daily commutes and occasional trips, and inquired into their navigation practices, route choices and on-the-fly decision-making. We found that while drivers choose a recommended route in urgent situations, many still preferred to follow familiar routes. Drivers deviated because of a recommendation's use of unfamiliar roads, lack of local context, perceived driving unsuitability, and inconsistencies with realized navigation experiences. Our findings and implications emphasize their personalization needs, and how the right amount of algorithmic sophistication can encourage behavioral adaptation."
370,I Bought This for Me to Look More Ordinary: A Study of Blind People Doing Online Shopping,370,"Online shopping, by reducing the needs for traveling, has become an essential part of lives for people with visual impairments. However, in HCI, research on online shopping for them has only been limited to the analysis of accessibility and usability issues. To develop a broader and better understanding of how visually impaired people shop online and design accordingly, we conducted a qualitative study with twenty blind people. Our study highlighted that blind people's desire of being treated as ordinary had significantly shaped their online shopping practices: very attentive to the visual appearance of the goods even they themselves could not see and taking great pain to find and learn what commodities are visually appropriate for them. This paper reports how their trying to appear ordinary is manifested in online shopping and suggests design implications to support these practices."
371,Touchscreen Haptic Augmentation Effects on Tapping Drag and Drop and Path Following,371,"We study the effects of haptic augmentation on tapping, path following, and drag & drop tasks based on a recent flagship smartphone with refined touch sensing and haptic actuator technologies. Results show actuated haptic confirmation on tapping targets was subjectively appreciated by some users but did not improve tapping speed or accuracy. For drag & drop, a clear performance improvement was measured when haptic feedback is applied to target boundary crossing, particularly when the targets are small. For path following tasks, virtual haptic feedback improved accuracy at a reduced speed in a sitting condition. Stronger results were achieved in a physical haptic mock-up. Overall, we found actuated touchscreen haptic feedback particularly effective when the touched object was visually interfered by the finger. Participants subjective experience of haptic feedback in all tasks tended to be more positive than their time or accuracy performance suggests. We compare and discuss these findings with previous results on early generations of devices. The work provides an empirical foundation to product design and future research of touch input and haptic systems."
372,Opportunities for Automating Email Processing: A Need-Finding Study,372,"Email management consumes significant effort from senders and recipients. Some of this work might be automatable. We performed a mixed-methods need-finding study to learn: (i) what sort of automatic email handling users want, and (ii) what kinds of information and computation are needed to support that automation. Our investigation included a design workshop to identify categories of needs, a survey to better understand those categories, and a classification of existing email automation software to determine which needs have been addressed. Our results highlight the need for: a richer data model for rules, more ways to manage attention, leveraging internal and external email context, complex processing such as response aggregation, and affordances for senders. To further investigate our findings, we developed a platform for authoring small scripts over a user's inbox. Of the automations found in our studies, half are impossible in popular email clients, motivating new design directions."
373,Examining Augmented Virtuality Impairment Simulation for Mobile App Accessibility Design,373,"With mobile apps rapidly permeating all aspects of daily living with use by all segments of the population, it is crucial to support the evaluation of app usability for specific impaired users to improve app accessibility. In this work, we examine the effects of using our augmented virtuality impairment simulation system--Empath-D--to support experienced designer-developers to redesign a mockup of commonly used mobile application for cataract-impaired users, comparing this with existing tools that aid designing for accessibility. We show that the use of augmented virtuality for assessing usability supports enhanced usability challenge identification, finding more defects and doing so more accurately than with existing methods. Through our user interviews, we also show that augmented virtuality impairment simulation supports realistic interaction and evaluation to provide a concrete understanding over the usability challenges that impaired users face, and complements the existing guidelines-based approaches meant for general accessibility."
374,Accessible Gesture Typing for Non-Visual Text Entry on Smartphones,374,"Gesture typing--entering a word by gliding the finger sequentially over letter to letter-- has been widely supported on smartphones for sighted users. However, this input paradigm is currently inaccessible to blind users: it is difficult to draw shape gestures on a virtual keyboard without access to key visuals. This paper describes the design of accessible gesture typing, to bring this input paradigm to blind users. To help blind users figure out key locations, the design incorporates the familiar screen-reader supported touch exploration that narrates the keys as the user drags the finger across the keyboard. The design allows users to seamlessly switch between exploration and gesture typing mode by simply lifting the finger. Continuous touch-exploration like audio feedback is provided during word shape construction that helps the user glide in the right direction of the key locations constituting the word. Exploration mode resumes once word shape is completed. Distinct earcons help distinguish gesture typing mode from touch exploration mode, and thereby avoid unintended mix-ups. A user study with 14 blind people shows 35% increment in their typing speed, indicative of the promise and potential of gesture typing technology for non-visual text entry."
375,Gabber: Supporting Voice in Participatory Qualitative Practices,375,"We describe the iterative design, development and learning process we undertook to produce Gabber, a digital platform that aims to support distributed capture of spoken interviews and discussions, and their qualitative analysis. Our aim is to reduce both expertise and cost barriers associated with existing technologies, making the process more inclusive. Gabber structures distributed audio data capture, facilitates participatory sensemaking, and supports collaborative reuse of audio. We describe our design and development journey across three distinct field trials over a two-year period. Reflecting on the iterative design process, we offer insights into the challenges faced by non-experts throughout their qualitative practices, and provide guidance for researchers designing systems to support engagement in these practices."
376,Voice User Interfaces in Schools: Co-designing for Inclusion with Visually-Impaired and Sighted Pupils,376,"Voice user interfaces (VUIs) are increasingly popular, particularly in homes. However, little research has investigated their potential in other settings, such as schools. We investigated how VUIs could support inclusive education, particularly for pupils with visual impairments (VIs). We organised focused discussions with educators at a school, with support staff from local authorities and, through bodystorming, with a class of 27 pupils. We then ran a series of co-design workshops with participants with mixed-visual abilities to design an educational VUI application. This provided insights into challenges faced by pupils with VIs in mainstream schools, and opened a space for educators, sighted and visually impaired pupils to reflect on and design for their shared learning experiences through VUIs. We present scenarios, a design space and an example application that show novel ways of using VUIs for inclusive education. We also reflect on co-designing with mixed-visual-ability groups in this space."
